{
    "nome_ambiente": "sala_de_estar",
    "escala_metros_por_tile": 0.5,
    "paredes": [
      {"inicio": [0, 0], "fim": [5, 0]},
      {"inicio": [5, 0], "fim": [5, 4]},
      {"inicio": [5, 4], "fim": [0, 4]},
      {"inicio": [0, 4], "fim": [0, 0]}
    ],
    "portas": [
      {"posicao": [2, 0], "largura": 0.9}
    ],
    "janelas": [
      {"posicao": [5, 2], "largura": 1.2}
    ],
    "objetos": [
      {"tipo": "sofa", "posicao": [1, 3]},
      {"tipo": "mesa", "posicao": [3, 1]}
    ]
  }